{
    "window":{
        "bg-color":  "#1F1F1F"
    },
    "button":{
        "bg-color": "#242424",
        "text-color": "white"
    },
    "label":{
        "bg-color": "#1F1F1F",
        "text-color": "white"
    },
    "checkbox":{
        "bg-color": "#1F1F1F",
        "text-color": "#29FF00"
    }
}